Username,Content
draoikat,"My husband and I were both longtime members of a discussion forum, struck up a friendship in 2018, and the connection became... not so platonic haha... in 2020, early in the pandemic. I hadn't ever expected anything to happen tbh, but I'd had a slowly-growing crush for a while by that point. Because of pandemic travel restrictions (he was in the UK, I'm in Canada) and his work and a few other factors, it was a while before we got to actually visit... but the day he walked through the door and we hugged for the first time was one of the best days of my life. After a number of visits over the next few years, he moved here last autumn and we got married in May. What made it work was of course in part just the connection we had, but also lots of active effort to maintain good communication, spend time 'together' and be a part of each other's daily lives from afar, honesty and openness, getting creative with ways to share sexual intimacy even when not physically in the same space, actively making plans for the future... basically just not being passive about the connection in any way. My relationship with my ex-girlfriend was also largely long-distance and didn't work out, although the distance wasn't particularly the reason there. Too many other issues that made the connection unhealthy and it wouldn't have worked even if we'd lived five minutes apart."
One-Recover7127,"My relationship with my now husband started off long distance. I wont lie, it was tough. My husband was not keen on the long distance at all. He infact was very clear that he didnt want to get into unless we were in the same city. But we just fell into it and it became a relationship without any of us asking. We really tried to see each other for a week every 3-4 months - either at his place, mine or somewhere in between. We did this for three years before we got married, and it was the best decision of my life. I think what makes it work is just the willingness of two people. There are no external factors involved, imo. If two people are committed and inclined to see things through, there's nothing that comes in between."
whitneyhoust0n,"I’m in a medium distance relationship right now (about 2 hours away) but we go to different colleges and have opposite job schedules (I work weekdays and he works weekends). I would say one key thing is understanding that you guys are living two different lives and that it’s okay to be busy as long as you still can communicate effectively. Another thing, phone calls. Oh my god. A lot of words and things can be misinterpreted over texts so it’s good to touch base whenever you guys can. Fights. Should. Not. Be. Over. TEXT!"
SaltyIsabella,"I did long distance for a year. Video calls, honesty, loyalty and making future plans really helped. It was tough and our trust was tested many times. The adjustments wasn't easy either. Going from being with him whenever I wanted to barely catching each other because one of use was busy. But if you're both honest and committed, it can work."
Hot-Chemist1784,"long distance only works if there’s a clear end game and you both actually meet early on. without that, you're just dating a wifi signal and losing time."
sakuraminoyashi,"I've had my fair share of LDRs. My LDRs were online from Discord. They're usually tough because your relationship is put on the pedestal, tested through many obstacles from life thrown at you. It's testing your communication, trust, confidence with said person. What worked: Communicating everyday, whether it's video calls once a week or texting each other. Having a goal to meetup some day in person. Back when me and my ex were LDR dating, we met up in-person after 3 months of dating online. It was cute to finally meetup after talking online for a while. What didn't work: Having no plans of meeting up, whatsoever. I remembered dating a guy in my Undergrad and he called it off after a month because we were from different countries and had no plan to meetup. Another thing is finances. Finances are huge topic in relationships, and if you don't have the money to meetup, it may not work. Long-term goals: make sure you both are aligned with the long term goal of the relationship. If there is no end goal of moving in together or the values are misaligned, then it won't work. Relationships take work."
BrooklynNotNY,My fiancé and I started long distance. We met in my hometown. I was living 6 hours away. What honestly really made our relationship work was that I already had a plan to move back to the area. So knowing that at some point in the immediate future we would be in the same city made long distance manageable. It also gave us something to look forward to. Lots of visiting each other and FaceTimes.
EnoughNumbersAlready,"Started long distance (across the ocean and 2 time zones) all thanks to Hinge. We did long distance for 6 months, then met at the airport when he picked me up. The first time we met in person was awesome and I still feel butterflies. He had made me homemade gluten free Christmas cookies from his culture (I’m celiac). We’re now married and I wouldn’t change anything about how we met and the long distance. It was really difficult but it helped knowing we weren’t long distance forever. Also, communicating clearly and setting clear expectations for our communication was extremely important in the long distance phase."
Klutzy_District_8303,Every city should provide their own woman or man !
Tiny_Jumping_Beans,"As a gamer I’ve had several different long distance relationships that varied a lot, and I married the last one. You have to make intimacy a focus, because you lose the pillow talk aspects of being with someone unless you make sure to fit it in. Honestly talking right before bed about nothing is great. You need a plan for getting together eventually, even if it starts as a loose idea. With my husband we planned to move in together a year after our LDR started cause his lease would be up. Without a plan, your partner might have no stake in the relationship. I had that with one guy. He didn’t tell his family or friends about me and actively didn’t want me to move to his city cause “it’s expensive.” I dumped him when I realized it was going nowhere. If you can tell they’re just not that into you, it won’t get better. Cut the cord. And then you need appropriate boundaries and a strong level of comfort with your partner. I dated a guy from another country, and it was great for two years. We had such good online chemistry, and we probably could have kept that up for several years if not for his extremely controlling behavior. He wanted me to be online 100% of my free time and was jealous of my COUSIN. He was so much worse in person. I would say every time it failed was because of incompatibility rather than the long distance. Long distance sucks, but it’s very doable if you include each other in your day to day lives and do online activities together regularly. And meet irl whenever you can."
hyperlight85,"Hi there. This is kind of long so AIA. TW/CW: I got into one with someone I had known for years right before the pandemic. Then we couldn't see each other in person because my country didn't lift the travel ban until 2022. So we went through it all togther on Discord every morning and night. We went through highs, lows, severe diagnosed mental illness together. We went through at least two surgeries on my side. So by the time we were able to travel, we kind of knew the best and worst of each other. We've had two big trips together and I'm closing the gap this year or at least that is the plan. I have been unfortunately diagnosed by my therapist as having CPTSD. and now that I'm in a safe place with being no contact all of the stuff is coming out of me and I am in treatment with both my therapist and psychiatrist as I had to get rediagnosed for ADHD for management of those symptoms What made it work: communication, honestly and above all you both still have to have your own lives. Because I made the mistake of making him my only emotional support and he felt like he had to be mine and pulled away from a lot of his friends. Also he is having to learn how to be emotionally intelligent enough to have the hard conversations. We both are. And a lot of this is true whether your relationship is LDR or with someone locally. I have found that being in an LDR comes with this weird pressure from sooooooo many people who aren't in the relationship. And part of the reason for me going no contact with my parents was that my mother kept trying to insert herself into my relationship. I got everything under the sun from ""your bf is going to cheat on you if you don't immediately go and see him"" (this was during lockdown btw) to ""if you're not going to get started on the visa you should just break up with him"" and my persona fav ""he's going to have to sell his house"". It is crazy the pressure people put on you the moment they know about an LDR like they think you can just immediately hop up and change everything or plan a visit. I was a broke person when this started and my situation has changed a lot and its very feasible for me to move to him since we are going to own his parents house and we have a cat. I guess my advice here is to have a timeline but be clear with people that their opinions have nothing to do with you and how you are moving forward."
kittyprincessxX,"Setting out a certain time to hang out (e.g. 9pm till 12am everyday). So there's a routine of sorts :') Also, having an ""end"" date to the LDR"
SparkleSelkie,I mean what are we considering long distance?
Chomprz,"Unfortunately, all of my long distance relationships didn’t work out. Even the long many years ones. We spent every day together, but I guess there weren’t any true efforts to meeting up and/or closing the gap, despite discussing about it lots. Sometimes fought hard about it. I don’t trust doing long distance anymore. I need someone by my side every day, to touch and hold close."
galaxystarsmoon,"The long distance part sucked and we were in different countries. We got married and closed the gap, and are still together and very happy 15 years later."
smokeehayes,Actually closing the distance. It's not without its own challenges but it's so much better than it was before I moved.
Olena_Mondbeta,"My relationship started long-distance - we met at an event and lived about 6-7 hours driving apart. That he had to work shift, also on weekends, did not help, but we could see each other every 4-8 weeks. It was not super hard for me because I'm someone who is quite happy alone, but also, videocalls made it much easier than it would have been 20 years ago. We got engaged while still living apart, he moved in 2 months before the wedding (after a bit more than 3 years together) and we are currently expecting our first child :)"
Brief_Lion_1761,if you really love each other everything is possible
tawny-she-wolf,"Did it once. Best relationship ever, closed the distance after a year and now we're engaged (4 years later). Being responsible adults who are generally chill and flexible with good communication definitely was the key. Neither of us are jealous people, we clicked super well and made plans to close the distance asap, texted every day and made efforts to visit back and forth in the meantime."
OCGHand,"Didn’t work out in the end. LDR relationship did the video calls, had conversations, set goals to be together and had ups and downs. She graduated from College and came back. We lived together, but those ups and downs were a sign that the relationship is not going to last. She decided we were not a fit anymore and ended the relationship. Looking back with the experience I have now the relationship should have ended the relationship when she went off to College when I experienced the first down. LDR can work, but it requires a lot of effort from both sides, set achievable goals to the big goal, and creativity so both parties feel the love to overcome the long distance."
[deleted],"I have been in a few, none of them started as LDRs. One didn't work because I was too young, and he was abusive. The second one was only a LDR for a few months while I studied abroad, but I think that time apart helped sink the ship. I realized I was more mature than him, and as much as I really liked him (we were very good friends and definitely had physical chemistry), it just wasn't a good fit long-term. He never cared about me as much as I cared about him. The third time, it was a rekindling of an old high school relationship while he was stationed on the opposite coast. Only lasted a couple months. So, in my experience, not great, but I think they were just not great relationships to begin with. Being long-distance can put incredible strain on a relationship, so it takes a lot of care to make it work. But on the other hand, if it's not really a great relationship to begin with, you'll probably figure that out going LD."
JustLayneIt,"My boyfriend and I are long distance. We dated for a time as kids and it didn’t work out. We were young, naive, and simply didn’t have the resources to make a long distance relationship work at the time. Now, we are older, more mature, and have the resources and we are more in love than ever and hoping to close the gap in the fall. It takes a lot of honesty, trust, and good and clear communication."
antisocial_moth2,"We met when we were 10, apparently both had crushes on each other while we were in school together, I moved away when we were 12, we remained friends, and confessed our feelings in high school. It didn’t last very long because at that point I was over 1,400 miles away & we were teenagers. I really don’t believe in long distance relationships (at least for myself personally). I do think we could’ve worked out (better, but probably not have ended up together) had I not left. It helped that we had known each other for several years & talked all the time, but not being in the same place as someone really hinders your closeness. You can’t actually go on dates, you feel like you have totally separate lives because you can’t do things together, and it just fizzled out. Our last conversation was in 2021, but I will always wish him well."
PeachyTwistcandy,Communication but it didn't work out but the relationship lasted 2 years though.
[deleted],"Hello u/spiderdumpling. Thank you for participating in r/AskWomen. Please read this entire message before taking action. Your submission has been removed, because your account does not have a verified email. No exceptions will be granted. You can verify your email address on the Reddit Preferences page, and if you have any issues with verification please contact reddit support at r/help. Subreddit moderators do not have the tools to aid with verification, so please ignore the bot in italics below, do not message the mod team about this as we have no way of helping you. I am a bot, and this action was performed automatically. Please contact the moderators of this subreddit if you have any questions or concerns."
AutoModerator,"Hello u/spiderdumpling. Thank you for participating in r/AskWomen. Please read this entire message before taking action. Your submission has been removed, because your account does not have a verified email. No exceptions will be granted. You can verify your email address on the Reddit Preferences page, and if you have any issues with verification please contact reddit support at r/help. Subreddit moderators do not have the tools to aid with verification, so please ignore the bot in italics below, do not message the mod team about this as we have no way of helping you. I am a bot, and this action was performed automatically. Please contact the moderators of this subreddit if you have any questions or concerns."
AleksandraLisowska,"I was 13 and he was 14 and we lived in different regions but my best friend is her cousin. So we met at the graduation dance and kissed and danced the whole summer. My dad is a teacher and here in Chile the respect from the directors and owners are like shit, so in march when school starts, they fired him and we moved to another region, making us two further apart and we were so little we could handle it. He was into my cousin too and kissed another girl from his class while I was just being a child, a new girl in a new town. So it was so lonely I said goodbye, told my mom and cried until I got to dress in my school uniform that morning. I swear I never again cried for it, it was a relief for my little own self at the time. What made it work while it worked? True childish love, the first love. What made it not? He was following his dad cheating habits. I still am friends with my bff and of course I saw him a lot of times in the summer vacations, but he was vile with his girlfriends and kind of an asshole. So, maturity won, his lack of I mean. Because when we were together we were children, but at 28? Nah, I believe I was lucky."
Andwaee,"I've done it a lot and what I found made it work is having a VERY strict rules. At first I had a 2 year rule. If we have not met irl by the time it hits 2 years, we break up. No exceptions. I've said that to previous LDR's and I dont know if they thought I would forget I said that or what, but it was clear they had no intentions of meeting soon and kept wanting to push it off and stay in fantasy lalaland-like no. We are not wasting my time. So then I bumped it up to, ""Until we've met irl, we are not boyfriend and girlfriend. We are not dating, you are just a stranger on my screen typing at me"". And that's how I finally met someone who was serious, and we've been together since. Have been on beautiful trips, has met my family, had great food together and I know when he talks about our future together, he's actively taking steps to make it reality. When we talk about moving in together, we're planning it out step by step seriously and not just daydreaming like past men have wasted my time doing. You really have to filter hard for it to work out. Lot of people like the comfort of living in a fantasy. Very few have the drive and commitment to turn it into a reality."
snailminister,"We started as LDR and are married now. Trust, communication and knowing what our goal was helped us through periods of living apart."
[deleted],I went off to college. It didn't end up working out. We were both lesbians still in the closet so between the distance and the secrecy it was just too much stress. Even when I did go home for holidays it was super hard to get time alone together.
plushyLady,We made it work for about eight months until I realized I was spending more on plane tickets than rent. The financial stress was insane and we both started resenting having to choose between seeing each other and paying bills.
SouthEast_Milf,"Once, I dated a guy from another state, but he cheated on me... It's really hard all the goodbyes, and I'm not sure if you gonna see each other... Lesson not learned lol cause I dated again another one from another state on my 30's... much better lol after 6 months, we were living together, and now we've been together for 15 years."
MiaOh,Didn’t work because I was working when he left work and he expected me to restructure my time prioritizing his calls above all else.
[deleted],Heading into year three. The 1.5-year mark was rough because there wasn't an end in sight and we couldn't agree on where to live. I wanted out. We worked through that and made a plan which made things much smoother. We see each other every other weekend and are working towards living together and being able to enjoy life with one another.
TheJusticeFactory,"I think long distance only works when you have a time cap. Say 6 months. A year. When you go long distance without an established time frame, I think it's prone to fail. Doesn't mean it will, but the odds are that it will."
[deleted],"Hello u/alouqua221. Please read this entire message before taking action. Your post or comment has been removed because your Reddit Karma is too low to participate on AskWomen. You will be able to participate when your Karma has increased, you can do that by participating in good faith in other subreddits that don't have Karma requirements. This action cannnot be undone by the moderators. No exceptions to this rule will be granted. Click here to read more about Reddit Karma, and please also read our rules before participating. I am a bot, and this action was performed automatically. Please contact the moderators of this subreddit if you have any questions or concerns."
AutoModerator,"Hello u/alouqua221. Please read this entire message before taking action. Your post or comment has been removed because your Reddit Karma is too low to participate on AskWomen. You will be able to participate when your Karma has increased, you can do that by participating in good faith in other subreddits that don't have Karma requirements. This action cannnot be undone by the moderators. No exceptions to this rule will be granted. Click here to read more about Reddit Karma, and please also read our rules before participating. I am a bot, and this action was performed automatically. Please contact the moderators of this subreddit if you have any questions or concerns."
trialbytruth,I met my bf in the summer of 2021 and then left for grad school in the fall. I do think the stars kind of aligned for us sign it was still COVID and everyone was at home FaceTiming each other so we eased into that pretty quickly. We did a lot of virtual movie nights and sometimes just even stayed on FaceTime overnight to feel less lonely. Also flights were very cheap then so it was doable for him to come see me often. I’d say work in some sort of call/FaceTime schedule that mimics “normal” life - like a call after work to debrief the day or FaceTime while making dinner.
[deleted],"I’m marrying mine 🥰 However, we already knew each other personally when we got together. He had moved away a year prior due to work. Communication, loyalty, & trust are the 3 main ingredients for any of it to work!"
[deleted],"Hello u/jan_ldr. Please read this entire message before taking action. Your post or comment has been removed because your Reddit Karma is too low to participate on AskWomen. You will be able to participate when your Karma has increased, you can do that by participating in good faith in other subreddits that don't have Karma requirements. This action cannot be undone by the moderators. No exceptions to this rule will be granted. Click here to read more about Reddit Karma, and please also read our rules before participating. I am a bot, and this action was performed automatically. Please contact the moderators of this subreddit if you have any questions or concerns."
AutoModerator,"Hello u/jan_ldr. Please read this entire message before taking action. Your post or comment has been removed because your Reddit Karma is too low to participate on AskWomen. You will be able to participate when your Karma has increased, you can do that by participating in good faith in other subreddits that don't have Karma requirements. This action cannot be undone by the moderators. No exceptions to this rule will be granted. Click here to read more about Reddit Karma, and please also read our rules before participating. I am a bot, and this action was performed automatically. Please contact the moderators of this subreddit if you have any questions or concerns."
queercowboycentral,"I met my current girlfriend in my 2nd year. She's the best thing that's ever happened to me. I had to cut my 3rd year a little short and move home due to family stuff, so we went from seeing each other 2/3 times a week to maybe once every 2/3 weeks as we live a long train ride away from one another (which is far more fortunate than living countries apart.) It's been difficult, but we don't argue and we make it work. I highly recommend calling often and doing an activity like playing video games together, it's helped quell how much we miss each other. We're planning on maybe moving in with one another sometime soon. Hoping and praying that it works out long term."
crazyjesus24,Been with my girlfriend for 6 years. When we met she was 3rd year of uni 300miles away in Scotland then when she moved home I went off to uni as a mature student 100miles away and then worked my summers 500miles away in Scotland. We're still together and happy I'm due to graduate next month and then we'll only be 30miles away from eachother! closest we'll ever have been!
Puzzled-Barnacle-200,"My partner and I met at university. We both did a placement year in our 3rd year at uni, and agreed that we would just both go for the best jobs, rather than try to stay close to each other, as it would only be 15 months. We ended up ""mid-distance"" seeing each other about every 3 weeks. Then covid happened and we couldn't see each other for over 3 months. That was rough. After that we were back in the same uni city again, in separate house shares. We both did a masters and agree to live together in our 5th year. On our placent year we had agreed not to be long distance after graduation, and as I was invited back to my placement company, my partner found a job around mine. We rented together, got engaged, bought a house, and recently adopted a pair of kittens. This time next year we will be married."
Rampant_Monkey,"I met my partner when I was in 2nd year and he was in final year. Once I graduated I moved to where he was working, but he then moved abroad for 12+ months, and 6 months into that (and my mum dying) I realized he didn't add enough to my life and I dumped him."
