Username,Content
Fearless_Spring5611,"We'd been together four years, she moved to Canada just as I started out in UK uni. Flew out to see her for Christmas - not only did she (apparently) not recognise me, she then introduced me to her new fiancee (they'd met three weeks earlier). Cue the worst month of my life - and I'd still contend it was on par with the worst of my COVID-19 days. Tried again with another woman for my next degree, again we'd been together four years by then. By February she ended up taking the house, the car, and all the furniture with her in the separation. Third time's the charm though."
BlueberrySharp3,Were you talking to her before you flew out to see her? I don’t understand how that works. When you told her you were coming for Christmas she didn’t tell you she was with someone else??
Fearless_Spring5611,"We were talking daily - MSN Messenger/Yahoo Messenger was our preferred method of contact. Normally late in the evening for me as well to account for time difference - caused more than one late night during that first term! The trip for Christmas had been arranged that summer, and was a very openly discussed arrangement as I was staying there for a month. And no, she didn't tell me until I was there."
LivingProfessional59,Thank you for sharing your experience you’ve given me so much hope!
Illustrious_Math_369,"I went to uni in London, home is Wales. Met my ex through friends from home who was a Londoner recently moved to Wales. He still had an office job in London (in office twice a week, wfh in wales 3 days a week). Worked fine at first as he would come see me every week still. He got a new job opportunity in Wales and suddenly resented me for being so far. Turns out I alone wasn’t worth the travel (even monthly or biweekly as I tried to arrange). Its had as a student who has to work on weekends to survive, much more awkward to make it work."
konqr697,That's a shame honestly.. but yeah i get what you're feeling tbh. I was in an LDR but I had a job and she was in uni but ukw the magic died out cuz of the distance and the different lifestyles
AlrightyDave,Yet to happen in uni but lined up
ackbladder_,I met my girlfriend a month before going to uni in my hometown. I never would’ve sought out a relationship before leaving town but we clicked so well. I was an hour and a half from her uni and we saw eachother probably 2/3 weekends. It was difficult at times but only because of how much we missed being together. We lived together on placement year and now after 5 years together we are happier than ever and living together. I’m so glad we stuck it out.
Admirable-Length178,Doesn't work and doesn't worth the trouble of worsening my mental health so not gonna do that again.
Roxygirl40,"Tried it, wasted 6 years with someone I had known many years prior. In the end, plans and goals change, people change. If you grow toward each other, then you’re the lucky ones. We grew way apart and it became toxic and abusive."
[deleted],"I had one and it was alright. It was a bit lonely at times but was okay. If I could go back and change it I probably wouldn't, it was a fun experience"
thebrowncanary,Met my fiancée when she moved into my flat in halls first year for her erasmus exchange from Finland. Flat-mates to friends and after an exchange of my own in the states we begun our relationship at the beginning of my final year. Now we are engaged and i'm moving to Finland in the autumn after two years of long distance. Never would have expected this when I started uni. Very grateful for those on the accommodation team at the University of East Anglia for changing my life forever.
1234_im_at_ur_door,"im going there, and my gfs gonna be in trinity hall cambridge. you think it'll work? I don't even know anymore."
thebrowncanary,Norwich to Cambridge is barely long distance to be honest. If you want it enough shouldn't be too hard to make it work.
[deleted],You are the exception to the rule
rampagingphallus,
[deleted],They are married with 2 kids
rampagingphallus,So’s your mum
Zealousideal-Fee8423,Why not say husband/wife then?
Rich-Kaleidoscope-21,"I'm going to be in three same position in a year and I'm really worried about the fact we'll both meet so many new people, be so far away from each other, and just a bit worried we could drift apart. We both don't want that and really want to make it work so I'm here looking for tips.  Got any?"
RCKJD,"Ages 51M (me), 52F (her). We met around 1998 in a chat roleplaying game and became a LDR couple in summer 2000. We see each other every day because we closed the gap in Spring 2001 and have been married since then. I am in this subreddit mostly to give “sage” advice and to show that it was possible over twenty years ago and thus it’s still possible now."
pandulupuuu,Dayum pappi you made to mama... This is truly inspiring ❤️ Thanks for sharing
Efficient-Trifle-882,Omg I love that!! Thanks for sharing
syksylo,"we're 21F and 27M, we met back in 2022. haven't met irl yet but meeting for this Christmas 🥰"
Sad_Translator2374,wish you the best holidays 🎄
[deleted],I wish you both all the best 💝💝💝💝
Sad_Translator2374,I wish you both all the best 💝💝💝💝
Lady-Gagax0x0,"In my long-distance relationship, we're both in our early twenties and have been together for six months, meeting every few weeks, with plans to close the gap in the next few months."
animatronic_lover,i’m 19 he’s 21. we met thru liking chuck e. cheese robots and other silly robots we even travel to go see all these run of the mill robot shows. we’ve known each other since i was 12 and he was 14 and we actually used to dislike each other when we were kids lol but last year before i traveled to europe for a couple of weeks he’d randomly send me reels and we started talking more and planned a meetup with him last year in july. we started dating in august or so of last year and honestly i couldn’t ask for a better partner. i never thought we’d go from enemies to lovers lol
General_Locksmith512,"We're both 22. We've been together for 5 years, met on Instagram. We meet 2 or 3 times a year, depending on our work/school schedule. Our plan to close the gap is to get married after I graduate and then move together to a different state in the US."
TeddyKlenk,"I'm 35,🇵🇭 , hes 29🇬🇧. We met on okcupid a year and 9 months ago. Took us 9 months to met up and met up every 5-6 months from then. Now we're engaged. We're just waiting for him to finish his degree (hes currently a design engineer but his company pays for his degree -4 more years) so he can move to be with me. It was funny because I was only on that app to find someone to talk during holidays because I was bored, wasnt looking for someone to date. 😂 . And i thought he was looking for a travel buddy. I stood him up for days ignoring his discord request. But as soon as we started talking, the calls never stopped until now."
CarelessSpirit321,"I’m 27 and he’s 31. We met online during the pandemic (may 2020) but we met in person until September 2022 and we decided to become a couple. He lives in the UK and I live in the USA but I’m Mexican, we see each other every 4-5 months (depending on our days off work). We’re planning in moving together by next year, we just started a process for a spouse visa for me in the UK, we’re just waiting on the final decision."
Wide-Comment-1137,"I am a 21F and he’s 32M. We meet on a language learning app called Tandem and we’ve been talking on a off for about a year . Finally in August of this year, I flew to DR. We’ve always talked about meeting one day but I never really put much thought into it until we actually met and the connection I felt with him was even stronger in person. I met his entire family , he took me out and his family also bought me food and offered their home to me next time I visit. I am set to return again in late November. I feel kinda guilty being that I originally wasn’t feeling him as much but then overtime I grew strong feelings for him. Our language barrier causes challenges at times but we still prevail despite that. I graduate college in seven months and we’ve talked of closing the distance within the next year"
[deleted],I am 22f and my man is 26. We have been together for 7 months. Not planned yet but I want to meet him. We do discuss about it alot tho but when the right times come we will both will meet hopefully 🥹
WolvenWren,"We’re 30F and 39M. We became friends on a social game and had been friends for some years. We don’t have a definitive date tbh, we kinda just waded in gradually but it’s definitely since early 2024. So far I’ve been to visit but as visits will pan out accordingly, every 6-7 months (very long distance - different hemispheres!) No definitive plans to close the gap yet, we’re visiting each others’ countries a few times to both get a feel for the other’s home before deciding and planning."
Obvious_Olive_7282,"I’m 29 and he’s 27, our 5 year anniversary is on Friday, and we’ve been friends for 14 years, we met locally as kids at youth group and grew up as friends with massive crushes on each other. He moved away right after we started dating, we try to see each other every 2-3 months but have gone up to 9 months apart. Right now we’re in the process of trying to close the distance, basically waiting on the bank to tell us yes or no for our house (fingers crossed it’s a yes, if so we’ll be living together by the end of the year!)"
Sad_Translator2374,good luck! 💞💞💞💞
Obvious_Olive_7282,"Thank you! The process would go much faster if he (and the area he’s in) wasn’t getting slammed with hurricane after hurricane, he’s got another one coming this week heading right for him 🥲"
Beargrizzled,"I’m 26m and he’s 23m, I’m from The UK and he is from The Netherlands, we see each other about 3 times a year, seeing him in less than 2 weeks"
PhoenixAquarium,"Both of us are 33. He is from California and I am from Texas. We been together for 9 years. We finally met on our 6th year in San Antonio. We used to see each other 4 times a year until I realized traveling is expensive and need to cut back. We seen each other once this year and maybe we will see each other for Christmas. Idk. We keeps talking about moving out to Nevada but nothing is set in stone yet. However, I'm patient. You have to be to make a LDR last. Likewise for communication. We videocall at least 2 times up to 5 times a week."
Acheleia,"I’m 34F and he’s 27M, been friends on fb for 2 years today, and dating for almost 2 years. We met in school, he decided he didn’t like it and I pushed for him to go home so he could be in a better environment. We’ve been long distance since December 2022. We see each other once a month or so until the summer when we can spend more time together, but since we’re both hella busy during the semester that once a month is usually only for a few days. We hopefully will close the gap in May when I’m done with my degree!"
Mommoth-Rush603,"I’m 50, he is 53. We met this year on a dating app. We live same state just a few hours away. We haven’t discussed closing the gap yet. But it is getting harder everytime we leave each other."
the0therangel,We are both 18 and met on a language exchange app and have been dating for almost 7 months. We met in person for the first time 2 months ago and plan to meet each other again in December. In the summer I plan to move to Japan to live with him while I go to language school there ❤️
Writer_feetlover,Tried it a couple times. Eventually the long drives got exhausting and the communication deteriorated.
TheStockFatherDC,It’s like single but worse.
octoelephant22,It’s the opposite of being friends with benefits. You get all the responsibilities and none of the perks.
[deleted],I met my husband online. I am from Australia and he from US It can be very challenging and during covid went two and a half years without seeing each other. I now live in the US last two and a half years and he is the love of my life. Was definitely worth it for me but will come at a cost of someone having to move away from your loved ones and can be expensive to go back home and visit. We have been together almost 8 years now
TopBound3x5,They almost never work.
I2eflex,"Tbf, most relationships don't work"
Fire-Wa1k-With-Me,"Yeah but you are comparing apples and oranges. The reason LDR don't work is often because they are LDR, and the relationship often doesn't even progress to the point where normal issues that people break up over start to spring up."
XylumFair,"Beware the false sense of knowing someone that can come from long weekends together once a month. I did long distance for 6 months with my last bf before he moved halfway across the country, to move in with me. We were both in midlife, more or less, and I feel we rushed the moving in together for fear of time slipping away from us. (I also had a larger home than I needed, and the cost of him purchasing or renting a comparable home to what he left seemed prohibitively more, so we rolled the dice and moved in.) Long story short, we turned out to be very mismatched in a number of ways. Things quickly surfaced that I would have learned sooner had we been in the same city and “hung out” more regularly. Red flags about his anger issues, problems at work, with finances, his inability to talk through difficult issues. With long distance, every visit is like a honeymoon. Moving forward, I won’t commit to anyone again without extensive “hanging out” in casual settings, in the same city, over time."
eatmeat2016,"In one three and a half years now. Daily video calls. A lot of travel back and forth. Planes and ferries galore and arranging work, doctors etc around extended trips can be awkward. But… worth it"
oldmannew,"Long, long distance love affair, oh, oh I can't find you anywhere, oh, oh I call you on the telephone But you're never home"
KTKannibal,They aren't easy but they are doable. It's easier if you have an end date to the separation versus just living far apart.
TheStockFatherDC,Might as well be single.
Antique_Fishtank,I married mine. Then he left me two years later. Make of that what you will. I will say though: it requires serious dedication to turn a long distance relationship into a local one. One of you will have to give up everything you've ever known and everyone you ever loved.
Eborys,"They suck but worth it in the end. My wife and I met online over 20 years ago. Met irl a year later, then for a couple of years it was a lot of back and forth between countries. Seeing each other when we could. And this was before FaceTime and iMessage etc, so it was all MSN or texts… the latter costing us a fortune each month. It was hell at the time but worth it now."
[deleted],Love is endless so distance doesn’t matter if the love is pure and unconditional.
Fallorey,Agreed!
Jr4D,Never worth it
DogsReadingBooks,I think most of hem are bound to break up.
CreedBrattonFC,Great if there is no “best friend” involved
XploringTheWorld,They cost a lot less now than they did 30 years ago.
kaanrifis,Will always end
organic_hive,In academia: long distance are pretty common because good positions are rare to suit for two people at the same time. Couples in two different countries or continentals are heard of.
cerisewa,"If there isn’t a concrete plan and timeline to move closer to or in with each other within a couple years, there’s no point."
SnooWords3275,If you are not fucking it's not a relationship lol
1DailyUser,Long distance relationships are foursomes or threesomes
BreadfruitNo9707,They're sleeping with someone else.
Honest_Act_2112,"You mean ""Who are my thots in my long distance relationships?"""
Dangerous-Ad-2308,"I’m married after doing distance for 3 years. Takes effort, isn’t easy but worth it for right person"
Appropriate_Tea9048,"They can work, but I think it’s rare. I could never do it."
Impossible_Crow_5060,They don't work
Wooden-Glove-2384,They are akin to pen pals of old ... people who wrote letters to each other but never interacted personally
SFishes12,It’s not good but better than nothing
GuybrushFunkwood,
CreepyPhotographer,"Great if you get or use frequent flyer miles, horrible for the rest."
Askready0,If your wife is with you and you both love each other very much then it is fun to visit the relatives of the messenger.
Used_Eggplant9725,"I am currently in the middle of one and while it’s really difficult, it makes the time that we do get to spend together very special and you really have to make a strong effort in order to keep things alive :-)"
bagado,Doomed to fail
[deleted],The connection is just not there when the person is far away.
Mercury82jg,End it or move.
Plumbus-Grab-816,They're pointless. It's like having a penpal.
Wide-Ad346,My husband and I started long distance. Married 3 years with an almost 2 year old!
swixstyx,I think it's more worth it to consider moving than it is to consider being together but apart
[deleted],Idk...he tell me I need a therapist and asj why I'm not sweet anymore.
[deleted],Waste of my time but ig it was fun to dream during covid.
[deleted],"If there is a solidified plan to move in together, then it will work. And I’m not talking about “okay move in a year or two”. It needs to become effective as soon as possible."
[deleted],They seem pretty rare to work out. It's nice to see when it does
iampowerful29,Not for me - it’s hard to truly know the person when you don’t see them in person in all kinds of seasons and day to day. Plus I want to have my partner very involved in my day to day life and vice versa. I’ve been in two long distance and let’s just say it took 2 years to find out who they truly are which was awful people. So miss me with long distance
Vistaus,I’ve had a few in the past and I would do it again.
[deleted],They are hard. Ive been in one on and off for over 2 years now and the distance never gets easier. And the hardest part is when the visits come to an end
Transicon21,It's not my thing
AgeInternational5130,"It sucks in the moment but is so worth it, if you have the right person. My now husband and I met and started dating in high school. He stayed in our home state for college and I moved 12ish hours away. We did all 4 years like that. I came home every winter break and summer break, plus any time I could, which luckily was a lot. He came out a few times, but it was expensive so it didn't happen a lot (he didn't have a car so flights were his only option). We did have a time where my spring break was the week before his so I came home and then we drove back to my school together for his spring break. It was really hard but it gave us the space we needed to grow ourselves while still being there for each other. We are married and have two Littles together, 15 years together now."
That_Ol_Cat,I think they are worth it (married her) but you really need to want to stay with each other. And you need to be able o visit face-to-face on average once per month.
Civilized_Primate,"They can work for as long as both people want to make it work. Emphasis on both.  My ex and I made it work for almost 5 years. It wasn't until she moved in during covid, then moved away for a new job that I realized it wasn't working for me. 90% of our communication was via text, and she was not as motivated as I was to change that."
[deleted],"Personally I found it really hard, to go from a few intense days together to not seeing each other. You're either spending time together or living your general life but not both. Some people really seem  to do well with it though."
lovealert911,"My wife and I met online, and we were in a 2000-mile long-distance relationship for about a year. We took turns flying out to visit one another every other month (4-day weekends) in addition to staying in contact via phone, text, and email. She'd fly out to California one month, and I'd fly out to Illinois the next. After about a year of doing that, I relocated to live together and another year after that we got married. That was almost 17 years ago. In my opinion LDRs are meant to be temporary. The goal is to be with the person you love. Whenever there is no realistic light at the end of the tunnel whereby someone will be relocating to be with the other, most couples in long distance relationships usually end up drifting apart. It is the counting down of the months, weeks, and days until one is finally done with the inconvenience of being in a long-distance relationship that keeps it strong! The only viable reason for being in a LDR is the belief you have met ""the one"". Otherwise, if you're just dating someone for the fun of it or just to see where things might go, you may as well do that locally. ""A long distance relationship can only work if there is a plan to end the distance."" - Paul Brunson"
jackal1871111,Not a fan at all tried it twice not for me
Wishilikedhugs,"Did it for a few years in the 00s. Was in a situation where either moving closer or in with the other wasn't possible (and work from home jobs practically didn't exist). When it was good, it was amazing and very loving... There were lonely times but I had so much freedom to do what I wanted and still feel connected to someone. After a while, she started to constantly badger me to find a way to make it work not LDR... And when I did find a way and started making moves to move there, she became very distant. It came out of nowhere. When I discussed it with her, we also talked about marriage and possibly moving forward with it, she told me the that I waited too long to ask. I made these arrangements as soon as it was possible and in the best financial position to do so. We split shortly after. Her sister, who I was still friendly with and occasionally talked to told me she went off the deep end with religion, married her retired English professor (who was 3 times her age), and went Qanon level conspiracy nutcase. She also got diagnosed with Borderline Personality Disorder, which explained a lot of her behavior. All that being said, I also did a long distance FWB during the entire course of the pandemic and it was one of the best experiences of my life, so I guess it's a mixed bag."
Atmosphere-Strong,I'm in one right now but I have been married for 7 years and he is only gone for a year.
[deleted],Depends on so much Did it in spurts over the 25 year length of our relationship But the goal was always singular
[deleted],man its a car which goes on the fuel of trust
NaturalOk3225,"Long-distance relationships: Hard mode unlocked. Communication, trust, and a solid WiFi connection are mandatory. Bonus points if you both have a plan to close the gap. Anyone here made it work?"
AquaPurity,"I could do it, but only if we would have creative dates on camera every week and see each other at least once a month. I can't be with someone who only wants to text."
Mediocre_Morning_391,I find it's a nice way to teach yourself self control!
5milliondollarz,They're stupid and not worth it.
Objective-Log4113,Long-distance love is good for four people.
podgladacz00,
Admirable-Nobody219,"not for everyone, depends on the people"
Eryka92,
octoelephant22,"Been there, done that, never again."
Muted_Glass_2113,"If it was a healthy and established relationship that will be long-distance temporarily, then it's worth it. If it's to *start* dating, then it doesn't make any fucking sense. If I can't actually go out on a date with you because you're too far away, then it's a non-starter. If it's a healthy relationship that will be long-distance for a greatly extended period, then you may as well just break up. You're going to be living entirely separate lives, so what's the point?"
Skourpi1,"I know this is asked in a romantic manner, but as a kid with a dad who was deployed for his longest was three years. If you want it bad enough, they can work."
Heavy_Direction1547,Rarely survive for long.
whomp1970,"My only thoughts are from experience. And from experience, I can say that they do not work. And I've been in enough of these, that I know I wouldn't ever entertain it again. Even if you CAN make it work, it's going to involve: More longing than other types of relationships. More cost (travel) More loneliness More touch deprivation Even if you CAN make it work, you will suffer so many other problems, you will have to put up with so many other things. I don't want to put myself through that, again."
Simple-Tone-1994,"Worthless. You dont cross the ocean to fish on the other side. There is plenty fish in your local lake. If you answer is ""well I want the fish from that location or that place"" then you think about your own good and not yet ripe for relationship."
Black_Power1312,"They are pointless and a waste of energy. It's just a bunch of ""I wish"" and ""if only"" going on and that leads to nothing tangible. I truly wonder why people want or are ok with long distance talking. I can't even call it a relationship cuz there's nothing happening besides talking."
[deleted],"Absence makes the heart go yonder. Love is not all you need to make a relationship work. You also need proximity. You need routine physical contact. And emotions are fickle. Thus, without a clear and early end date to the long distance period, it’s probably best to break up. If they’re going away for more than a year, you should let them go. If it’s meant to be, they’ll come back."
