Username,Content
Poltira,"Loads of people in this sub closed the gap, loads of people are making LDR work perfectly, and loads of people broke up. LDR is just like any other relationship, it can work or not. It depends on the couple, and the couple only"
AverageJimbo99,It works when you both agree to eventually close the gap and even better when you set a timeframe for when it will happen. Me and my Wife were LDR for 3 years before we closed the gap. We only met during vacations/holidays. Also daily communication is key. Tell each other the most random and small minute things. Share everything.
User_reddit__,It does work in a very rare case mine didn’t.
SirLunchALot1993,"It really depends on the people. If you are super needy, clingy and need lots of lots of phsyical Touch for validation then definetly no. If you are an introvert with a very small social battery and prefere to be alone often to calm down, then it is more likely. I personally Kind of like long distance relationships. The meetings are more intense. There is still this ""adventure"" feeling and you can keep that going for a longer time. You always have your own space, if you need it, no fights about doing the household in any kind of way and you can know better, that the other person actually wants to meet you. If you live together some people get too lazy or scared to move out and stay with the other person longer than they actually want. Both people need to enjoy the LDR or one needs to relocate. For me in the past I had two LDR that led to us living together and in both cases it was harder to live together than meet on the weekends. But seeing them everyday also was nice ofc. =) So in my case, yes they work, if the distance is reasonable. My max would probably be 6h of car ride, because that can be done over the weekend. If it would be more, that might be to troublesome for me, if I didnt plan to go to their location soon anyway."
OddParamedic4247,It depends on the person involved.
crani0,"Sure they can but it needs optimal conditions and it's a lot of work, some of it is regular relationship work and some of it is very unique LDR work. I was in one for 2 years with a girl from my home country and eventually the distance was too much. It was three months of calls, texting and sending memes. We also had to plan activities online together because we didn't always have topics for every call and it's not exactly like planning a romantic evening out and the effect definitely feels shorter, and then it was 2-3 weeks of being together and having to cram as many couple things we could, which also also involved arguing and the not so fun stuff that comes with a relationship, and then mixed with our own family/friends stuff. The whole relationship felt like a yo-yo and even looking back it definitely felt shorter than 2 years (but paradoxically I also feel like I have known her forever). It still surprises me when a photo of her/us pops up on my photo app and is dated to 2021 or 2022. But it's not all bad, we are still friends (which is also not always easy, but the distance here actually works a lot better) and talk regularly because in the end we realized that our setup might not work as romantic partners but there is still a friendship there from all the talking we did really digging into each other's being and we also mutually supported each other though trialing periods in ours lives which also leaves it's mark. We started talking and dating during corona, I had just moved to my new country and adjusting to it during corona was especially tough and she was unemployed because her work was gig based in an area that you really need connections in and while we were dating she went back to college for something that she is absolutely loving rn, so in the end I would say it ""worked out"" but maybe not in the sense that others would define it. Currently knowing the end result I still wouldn't have done anything different (not to say there aren't things I couldn't have handled better and I do have some regrets but it was part of the learning experience), but for sure I'm not ever considering doing it again One advice I would offer, after the six month mark start thinking about closing the gap, can even be a few years down the line, but just start planning for it because the anxiety of not knowing when you will be able to be together will grind the relationship down and it's easy to get too comfortable with your current setting when you are far from each other."
RainbowKitten9214,Did long distance for about a year and he was 8 hours away. Lots of communication and FaceTime. We also made sure that we both made an effort to visit each other once a month. We’ve been married 11 years.
n4styg0blin,"Yes! My wife and I did long distance for 10 years! We met online in 2013 as teenagers and visited back and forth between the US and the UK, usually twice a year. The pandemic was tough for us, we were hoping to start the immigration process in 2020 but everything slowed down with USCIS so we decided to wait. We ended up not being able to see one another for 1.5 years... When travel to the US reopened, we decided to have me stay in the US for 90 days while we prepped my K1 paperwork. The paperwork was sent off in Feb 2022. Everything was approved (albeit slowly) and I moved out to the US in September 2023, we got married and we couldn't be happier. We are closer and happier than we've ever been (and we were already secure in our relationship) and I wouldn't change all the hardship of long distance for this moment! Communication is king, but don't feel like you have to constantly be texting or on the phone. We would call once in a blue moon, if that. And give yourself visits to look forward to in advance! It makes the heartbreak of waiting so much easier when you know the next date you'll see eachother :)"
HLef,We were long distance (Canada-USA) for about 9 months. I drained my savings flying down there or flying her up to me every 3 weeks from January to September. I interviewed for a few positions that summer but in the end a he moved to Canada. Our 18th anniversary was a couple weeks ago and we have 2 kids.
ImpressiveWrap7363,I've always been so unlucky in love. But now I've finally found the right one. He's been my bestfriend for a while and now he's my boyfriend. He makes me feel so loved and beautiful.  But he's leaving the country for job and I've seen people in long distances casually throwing away their relationships. I absolutely trust him to the core. But I'm also anxious as I've never been in a long distance relationship before and I'm miserable asf thinking about it.
Commercial-Matter-43,Yes! My husband and I met online and we didn’t meet in person until after more than 1year and a half of talking.
Few-Music7739,"They can work, mine didn't. I know other couples who did and those who didn't. One of my acquaintances was dating a guy since middle school, he and his family moved across the world when he was in high school, they were long distance for nearly a decade before they got married in their 20's and now she moved abroad with him too. I know a couple who are married despite their distance. Both of them are college students... in two different countries. They literally planned to visit home over the summer at the same time and got married. But then there are people who didn't work out together. A friend of mine and his ex-wife have been living in two different countries for most of their marriage for college/work and recently divorced apparently because they realized they had completely different life and career goals. But they are both really nice people and continue to be on good terms. Honestly, I was so impressed by how they handled the situation that I think I kinda look up to them for how divorce should happen if it ever has to."
KatalinB,"Long distance works if there is a goal and an end “date”, where you know that in couple of months or year one of you will move. With my husband we were doing long distance for almost two years. It had the magic and I loved every minute of the traveling. I lived in Amsterdam and he lived in Athens. We met quite often. Then I decided that I will make a move as greek weather is nicer haha. We met 10 years ago, living together since 8 years, married since 2 and this year we had our first baby:) One big pro in long distance is that you both lear to trust! If there is no trust or even a little doubt, in my opinion the relationship will not work. Since we managed to manage that part well, even after moving together, trust is never an issue. Of course there has to be great communication!"
Tall-Comb7501,"Long distance relationships definitely can work, but it takes a lot of effort and commitment from both people involved. In my case, my partner and I started dating during college, and when graduation came, I moved to a different city for work while they stayed behind. At first, it was tough; we missed each other a lot and the time difference made scheduling calls a challenge. We made a point to set regular video calls and visit each other every month, which helped a lot. We also tried to find little ways to stay connected, like watching the same movies or playing online games together. It wasn't always easy, but we communicated openly about our feelings and challenges, which made a big difference. Eventually, after about a year and a half, we found a way to close the distance and moved in together. Looking back, the experience brought us closer in many ways, as we had to rely on trust and creativity to keep the romance alive. So yes, it can work, but you really need to be in it together and be willing to put in the effort."
Resident-Paper15,My story: Get to know each other online. Met for the first time in April 2023 in my country. we fell in love through texting/video calls. i flew to her place in February 2024 and we officially became a couple. 2 weeks ago she ghosted me without any reason and I am single now I guess 🥲
FatBottom_,"Am currently in one that is slowly eroding for me. It sucks. Once this is done, I'll never get in another one."
[deleted],"Spoilers: Reddit is 90% trashy people you'd see on a daytime talk show going ""mm mm girl he finna cheat on you (three snaps)"". Do you mean long distance like you started talking to someone on a forum and you want to meet up? It's great. Go for it. Challenging, but all good things in life can be challenging. Or do you mean long distance like one person is moving away for college? Statistically, most of those relationships break up. Just because there's a lot of change and hardship naturally happening. You can try to keep it going but don't be surprised if you drift apart, and maybe even reconnect later, or not."
Different_Memory2302,"Long distance for 2 years, married for 2 years now with a 9 months old boy"
SadAndHappyBear,Not in my experience.
MrsPaulBunion,I've never had one
[deleted],"Of course, But not if you’re <25 (live a little don’t settle down so early), Or if any of u cheated before. Because wandering eyes are bad in that sish. Generally they do."
[deleted],"Sadly in my case there's none, efforts trust nothing and communication ugh what's that!"
[deleted],"Sadly in my case there's none, efforts trust nothing and communication ugh what's that!"
80sBabyGirl,"I was in one for a long time. I saw how much organization, logistics, care, persistence and commitment are required on both sides to get it to work. Being both ready to move out or to help your partner move in. Being committed to learning about each other's country, culture, language when applicable, and starting to develop a new social circle before moving. Finding time to not only meet up but also be awake and communicate when time zones don't align. A huge lot of communication to compensate for physical distance as much as possible, both in matters of intimacy and deep conversations - this requires two secure, trusting and emotionally mature partners. Cultivating the emotional connection and commitment, being creative when it comes to intimacy, being okay with prioritizing emotional connection itself over physical presence, and being brave, independent and a fighter in life - unfortunately, a lot of people just can't keep emotional connection without constant physical presence, or aren't independent or courageous enough, and they shouldn't attempt a LDR (or even LD friendship) ! I was very invested in making things work. Unfortunately, things didn't work out on long term on my partner's side. I ended up maintaining the relationship on life support all by myself while he made no effort at all. I didn't even realize I was sinking into that situation, as we met when I was in my late twenties, and of course at that age (and also due to an unhealthy past) I used to tolerate a lot more than I should have. I now realize my situation was no different from many relationships where only one partner does all the work at home. And LDRs are a lot of work on both sides. Would I do it again, yes. But it does require a certain kind of personality to do it right, and there's not a lot of fish in the sea when it comes to finding the right partner in that regard. I still think it is rewarding when it works out, especially on long term. Obstacles and adversity such as LDRs are a test for our personal qualities and flaws. And I learned a lot about myself and what I wanted in life, even when things didn't work out in the end."
hauteburrrito,"Been in one. It sucked. Nearly broke up. Was the closest my relationship with my husband came to ending; -20/10 would not do again. We only survived because we had an end date very close to our final blowout fight. FWIW, we started out in person and then moved to long distance after like a year of dating. We did on/off long distance for maybe three years altogether. We were both entirely committed to the relationship, but the lack of physical intimacy really hurt us. To this day, I'm sure it was the worst thing we ever endured together - but perhaps because we did make it through, it made us far stronger than if we hadn't. (As for the adjustment back to in person, that's what saved us. Like, we got back together in person with a giant question mark over our heads because ending the relationship was a real option... but then yeah, he got off the plane, we fell into each other's arms, and it was like all of our (serious) conflicts just evaporated into thin air.)"
[deleted],"Thank you, it's great you guys made it through. We've got a solid end date set which helps"
hauteburrrito,"Definitely, yeah. I'm sorry you're in it now. It sucks, especially if physical touch is both of your top love language. I hope your end date is coming soon!"
FreindlyManitoba,"4 years in (CA/US). We are getting married this year. What works: communication. Planning, talks of the future/goals. We have spent the last 4 years discussing who moves where. We decided to choose a new city together which has been so much fun"
[deleted],Thank you this is beautiful ❤️
[deleted],Thank you this is beautiful ❤️
One-Bag-4956,"Was in one for 1.5 years. Was closing the gap, quitting job moving things etc to move to be with him (was interstate) and then found out he cheated. It wasn’t a good experience for me, but everyone is different so yours will hopefully work out ☺️ ldr are hard tho."
zooeyzoezoejr,How old were you? I hear they’re a bit better as you get older
One-Bag-4956,"I was 29, I’m 30 now. He was 28 if that helps"
Active_Recording_789,Yup I did it and am happily married to my LDR bf now. He was a lot more keen to end the LDR and be together IRL than me but I made several trips across the country to stay with him (which I could afford and enjoyed). I have to admit he expedited things faster than I would have but we’re going strong and very happy now
ngng0110,"Me! Together for 15 years, married almost 14. We were 30/32 when we met and had been married and divorced previously - I think having made some prior mistakes gives you perspective that’s harder to have otherwise. In spite of the distance, we were able to spend a fair amount of time together (due to flexible jobs and convenient circumstances), it felt right, and he moved to me 7 months after we met. Adjustment was honestly minimal, in my opinion less than many couples I knew who lived in the same state. Was I in my own head about the low chances of it working out at first, sure. But as they say, when you know, you know!"
stars_who_listen,flowery spark spoon head punch shaggy waiting pocket weather teeny This post was mass deleted and anonymized with Redact
Shep_vas_Normandy,"I am going to be real with you. I would never move to another country for another person, it can lead to resentment and it forces you to speed up your relationship before you’ve gotten a chance to really be in one.  Let me explain why I am saying this and what my experience was. I am an American, met my British ex while living in the US. Before I even met him I knew I wanted to move to the UK. This was around the end of Covid and I was able to visit the UK, but he was unable to visit the US initially due to restrictions. Initially it was great, I’d go every other month and stay with him and we would add more weeks to my visit each time to really understand better how compatible we were. What I learned was he was what I’d call a good “vacation boyfriend”. When he was happy and things were going well, he was great. When real life happened it was not great. I loved him and I could have married him, but I knew we needed to properly date before I could make that kind of commitment (especially since he has kids).  We didn’t even last, we broke up before I moved to the UK on my own and I now live in the UK and have a partner I met a couple of years ago.  With that being said, I know not everyone can move to another country on their own. But I think it is important to cohabitate first, not on vacation, just as normal people that go to work and have normal life stresses. That’s how you really get to know someone, not just when it’s all fun and you’ve been apart so it feels exciting and fresh."
prosperity4me,Asking on r/longdistance may be better
stylethelaughter,"So my first committed long distance relationship was long distance for the first year of us being together. We met in college, but we were both going to different schools. I would see him on the weekends, and then when we both went back home, maybe once in the summer. It was VERY hard. We would skype and text every day, but not seeing each other every day was difficult. And he was not a natural born texter/skyper, so he would sometimes go the entire day not talking, when I was looking for talking whenever he was free. I was dealing with a lot of mental health issues at the time, so that didn’t help. Eventually, I moved up to his hometown to get away from my family and since my college was in his hometown, so it made sense. Now, 7 years later, we are married and about to buy our first house (hopefully)! If you are considering a long distance relationship or are currently in one, it takes commitment. It takes patience. And there needs to be communication. It is a lot of work. And at some point, if it’s going to become a marriage or serious relationship, someone will at some point have to give and move to the other person’s area, or you move somewhere together. But a long distance relationship is feasible with 100% effort on both sides."
Gaboarincon,This is inspiring. Thank you
dontlookethel1215,"We lasted 4.5 years -- dating, cohabitation, engagement, marriage, divorce. We shouldn't have lasted longer than 3 months. We weren't suited. But I know that I attributed a lot of our dysfunction to our being long-distance. I thought that if only were were together more, could see each other more often, everything would be better between us. Perhaps he felt the same way. I'm sure some LD relationships can work, but just be honest with yourself. Don't rationalize or make excuses or think that proximity will solve significant issues."
aterriblefriend0,"Me and this person met via an online game. We were friends for a long while and helped eachother through some heavy times and their own breakup, and just before the start of the pandemic, we started dating long distance. Fast forward to the late middle of covid and I've lost my job, my roomate was ditching me, I was so broke that sometimes I ate sleep for dinner. I finally reached the end of what I could do and was prepping to be homeless (not the first time) when my partner told me I could come stay with them. We'd been dating maybe five months at that point. After doing my best to figure it out, I finally said yes. It was a huge risk. I even joked that they were either an axe murderer or the best thing that ever happened to me. They drove 14 hours to get to me. The first thing I said to them after our immediate first hug was ""Oh Shit. Your real"". We loaded all my stuff into their car, brought them to meet my family, and all our first dates were on the road. Four years later and that person is my Fiance. Unless it's the long con, I don't think they are an axe murderer. We adopted a kitten together last year who is a terrorist but we love him. Their family is amazing and I loved them. I haven't missed a meal in years and some of my issues that came from that have gone away. I am the happiest, healthiest and most in love I've ever been."
parisorientexpress,"My first one, we dated the first year long distance, closed the gap and broke up 2 years later. Currently in a similar situation. First year long distance (but much further - USA to France), and about to go stay in France for 3 months to see how that goes."
schecter_,"I'm surprised you decided to start another one this way. I was on a relationship that eventually turned into a medium distance relationship (3 hours away) and I would never...NEVER do that again, let alone a long distance."
parisorientexpress,"I may be kicking myself for starting another one this way at some point. But my current boyfriend and I have a lot more history than the first (have been friends for 14 years), and it overall seems more promising than the first as far as compatibility goes. I honestly don’t mind the distance much, as long as there are plans in place to close the gap eventually! That’s what this 3 month stay is for - to kind of feel things out. Wish me luck please!"
poopoola,"We met on IG in 2018. As soon as we met in person we were both head over heels with one another. It fell apart during COVID. I was depressed, he was out of work. It just kind of faded away, neither of us were doing great. Moved on with life, never really stopped thinking about him. He would reach out a few times a year. I was in his city last June and we met up for a drink. The first ten minutes was awkward and then it was pure magic. The I love yous came about an hour later lol. So yes, I’d do it again because that exactly what I’m doing now! I have a busy job and enjoy my independence. Thinking about him all the time keeps my heart full. We communicate daily and see each other every 4-8 weeks. I always have something to look forward to and our time together is incredible. I have a great job and close friend circle here. He can’t work fulsomely where I am, so we’ve talked about me moving there if in a year from now we are feeling like we want to make the leap. It’s daunting for me, I won’t lie. But we’ll see where things are at in a year’s time."
Affectionate-Pie1172,We’re married now!
wtfamidoing248,"I always said I wouldn't do long distance bc I wasn't a fan of that. I did do it, though, but it didn't start as long distance until a few months into the relationship. It was hard, and if I was ever single again, I would NOT do it again. I was right that it's not for me. I need regular affection and spending time in person often."
Main-Ladder-5663,"I met him while he was here on vacation when I was 19 and he was 20. We did long distance for a year, Skyped every day and texted and called throughout the day when we could. We flew back and forth every 3 months. I’d definitely do it all over again. We celebrate 14 years together next month."
0utandab0ut,"We did a 3 month test run before I uprooted my life and moved to be with her and her kids. By the time the honeymoon period wore off around month 2, I had started to see some huge problems that I never saw in our 2 years long distance. There are things you can’t see when you’re always in “vacation mode” visiting each other."
draoikat,"We're getting married next Saturday, on the exact five-year anniversary of the day we got together, so I'd say it turned out pretty great haha. We met on a discussion forum where we were both pretty active longtime members, were just friends for a few years first (though I realised I was slowly falling in love) and increasingly got closer emotionally, and then things got... not very platonic lol... on Skype one evening early in the pandemic. Been together ever since. We did long-distance (with visits obviously) for four and a half years, and last autumn he moved across the Atlantic from the UK to live with me here in Canada. It'll be the second marriage for both of us and I've no doubts that I've finally found my Person. As for would I do it again... well, I don't intend to lol, since I know I'm in the right relationship this time, but just the principle of it, yeah. I've always been open to long-distance and have done it before. I just need to know that there's commitment to the future there and that it's not always going to be that way and we'll find a way to be in the same place at some point."
