Username,Content
[deleted],"Hello u/Ok_bereal-4yagirl0. Please read this entire message before taking action. Your post or comment has been removed because your Reddit Karma is too low to participate on AskWomen. You will be able to participate when your Karma has increased, you can do that by participating in good faith in other subreddits that don't have Karma requirements. This action cannot be undone by the moderators. No exceptions to this rule will be granted. Click here to read more about Reddit Karma, and please also read our rules before participating. I am a bot, and this action was performed automatically. Please contact the moderators of this subreddit if you have any questions or concerns."
AutoModerator,"Hello u/Ok_bereal-4yagirl0. Please read this entire message before taking action. Your post or comment has been removed because your Reddit Karma is too low to participate on AskWomen. You will be able to participate when your Karma has increased, you can do that by participating in good faith in other subreddits that don't have Karma requirements. This action cannot be undone by the moderators. No exceptions to this rule will be granted. Click here to read more about Reddit Karma, and please also read our rules before participating. I am a bot, and this action was performed automatically. Please contact the moderators of this subreddit if you have any questions or concerns."
MiloAisBroodjeKaas,"Current relationship started as a long distance 7 years ago, we've been living together for over 2.5 years now. We met online, on some website. What made us start, we'd known each other for a few years, and we couldn't avoid our feelings for each other anymore, so we said 'might as well give it a proper go'. If I had to do it again, I would gladly go through every single hardship I'd faced to reach this point in my life exactly like this again."
[deleted],"Hello u/Icy_Ad68. Please read this entire message before taking action. Your post or comment has been removed because your Reddit Karma is too low to participate on AskWomen. You will be able to participate when your Karma has increased, you can do that by participating in good faith in other subreddits that don't have Karma requirements. This action cannnot be undone by the moderators. No exceptions to this rule will be granted. Click here to read more about Reddit Karma, and please also read our rules before participating. I am a bot, and this action was performed automatically. Please contact the moderators of this subreddit if you have any questions or concerns."
AutoModerator,"Hello u/Icy_Ad68. Please read this entire message before taking action. Your post or comment has been removed because your Reddit Karma is too low to participate on AskWomen. You will be able to participate when your Karma has increased, you can do that by participating in good faith in other subreddits that don't have Karma requirements. This action cannnot be undone by the moderators. No exceptions to this rule will be granted. Click here to read more about Reddit Karma, and please also read our rules before participating. I am a bot, and this action was performed automatically. Please contact the moderators of this subreddit if you have any questions or concerns."
[deleted],"Hello u/ilovemybffffffffffff. Please read this entire message before taking action. Your post or comment has been removed because your Reddit Karma is too low to participate on AskWomen. You will be able to participate when your Karma has increased, you can do that by participating in good faith in other subreddits that don't have Karma requirements. This action cannnot be undone by the moderators. No exceptions to this rule will be granted. Click here to read more about Reddit Karma, and please also read our rules before participating. I am a bot, and this action was performed automatically. Please contact the moderators of this subreddit if you have any questions or concerns."
AutoModerator,"Hello u/ilovemybffffffffffff. Please read this entire message before taking action. Your post or comment has been removed because your Reddit Karma is too low to participate on AskWomen. You will be able to participate when your Karma has increased, you can do that by participating in good faith in other subreddits that don't have Karma requirements. This action cannnot be undone by the moderators. No exceptions to this rule will be granted. Click here to read more about Reddit Karma, and please also read our rules before participating. I am a bot, and this action was performed automatically. Please contact the moderators of this subreddit if you have any questions or concerns."
[deleted],"Hello u/scanner8188. Please read this entire message before taking action. Your post or comment has been removed because your Reddit Karma is too low to participate on AskWomen. You will be able to participate when your Karma has increased, you can do that by participating in good faith in other subreddits that don't have Karma requirements. This action cannot be undone by the moderators. No exceptions to this rule will be granted. Click here to read more about Reddit Karma, and please also read our rules before participating. I am a bot, and this action was performed automatically. Please contact the moderators of this subreddit if you have any questions or concerns."
AutoModerator,"Hello u/scanner8188. Please read this entire message before taking action. Your post or comment has been removed because your Reddit Karma is too low to participate on AskWomen. You will be able to participate when your Karma has increased, you can do that by participating in good faith in other subreddits that don't have Karma requirements. This action cannot be undone by the moderators. No exceptions to this rule will be granted. Click here to read more about Reddit Karma, and please also read our rules before participating. I am a bot, and this action was performed automatically. Please contact the moderators of this subreddit if you have any questions or concerns."
Equivalent_Falcon599,Horrible. I don’t recommend it fo sho
AutoModerator,
motorcity612,"Long distance only really works if there is an end date to the ""distance"" as an indefinite long distance relationship is destined to not succeed in most instances. The distance has to be closed at some point otherwise what's the point of being in an indefinite long distance relationship?"
Sumo-Subjects,"Yup the examples I know of LDR working is when there was a pretty defined end to the LDR, either it was school, a deployment, or some job assignment, there had to be a specifically highlighted plan for at some point closing the distance."
bee102019,"This. I've been through 2.5 deployments with my husband (2.5 because he was injured during his last deployment and medically discharged). There was always an end in sight though, so it wasn't some sort of indefinite situation. To add to this, it requires two strong, independent, emotionally mature partners. If you're the type that is needy, codependent, needs a lot of attention, etc., long distance is a total non starter. Be realistic about your emotional needs before going into a LDR. And if they won't be met through a LDR, just bow out gracefully instead of dragging the inevitable out."
GhostsDNI,"I warn against it. People are not who they are online, they create a persona, they don't show you their flaws. My long distance relationship turned into an irl one, and I would have never gone out with a guy like him, he was so nice online and his whole personality flipped. He was a huge asshole. He did stuff like tell me stories about him and his friends bullying little kids like it was funny. It was actually shocking how many red flags didn't show up over a 2 year long internet relationship. I think long distance is more likely to work if all of that's already established and real."
CarLearner,On the contrary I’ve seen it be successful where my family has met their significant other from a different state and they met each other online. After a year of dating they met up once for a week maybe and then he moved to live with her. They’re still together and growing today. It all comes down to if the people in the relationship have a good heart or not in my opinion.
WasV3,"Needs two things. Start as a regular relationship End date on the horizon You can survive a partner going to Europe for 2 years to work, but you won't survive being 5 states apart and both being unwilling to move from family"
XxLogitech98xX,"No, LDR success is rare and someone will have to commit or you both meet somewhere in the middle"
PassportianAmerican,I don't believe in relationship no more period.
Human-Regionality,That’s wild. Lots of people are in happy relationships.
ThrowRA_PainntheVain,"My husband and I started off long distance for roughly a year.  Talked daily on the phone and would meet up every week/every other week.  I actually loved it cause I was forced to take my time getting to know him.  Everything moved pretty slow with us.  15 years later, 12 years married, and 7 kids, I’d say we are a success story."
sodapopkiddo,"LDR is really a test of honesty and willingness to really make it work. I have been in one twice and one of them eas really good, the other wasn't. It all depends on what kind of partner you have. Making a new relationship work as LDR is really tough, an older one is fairly easy as long as you continue to find new ways to show affection. Video calls are a must, pour out your emotions, cry if you can. Show them how much you miss them. Constant flirting or sexting is another must. Do a video call where you both tease each other and masturbate. Try to eat meals over regular calls or video calls, can be dates in restaurants too. Most important, give each other space. But not in a way where the other person is left alone without any plans while you are out enjoying and not even sparing few minutes to connect with them. Order meals, pastries, sweets or gifts for each other. Encourage your partner to socialize as well. Don't hoard all of their time."
Khromecowboy,Depends ok how you define long distance. I’m about 70ish miles from my girlfriend and we see each other every weekend.m from Friday to Sunday. Would that be considered an awfully long distance?
[deleted],No that’s not long distance. I live in the same area as mine and I only see her on the weekends
JDMWeeb,I would take that over not having a relationship at all honestly
Tyger-Rock,"Met my wife on a dating app, dated for 2 years long distance. Been married for 15 years now."
[deleted],"I believe they can happen successfully for some people. I know a man who started dating his wife long distance. They didn’t even meet in person until maybe a year in. A few months after that they were engaged and not long after that got married. They’re on 3 or 4 years happily married. Because of them, I know it’s possible. I just know I’ll never achieve it. I’ll never achieve relationships in general"
[deleted],If you’ve been dating for at least a yr plus and the long distance is only temporary sure. But it’s very difficult.
hella_14,"No. I want a partner everyday. I'll settle for once a week if it leads to every day. I want daily communication and connection, ideally physically."
Traditional_Youth648,"I am curious for some stories here, Im currently long distance, however my girlfriend and I were pretty close for a year in person, went on allot of dates and a 4 day camping trip together, now are official but long distance due to college choices and plan on visiting eachother as much as possible, so allot of the pitfalls we sorta avoid i believe"
Larkfor,They are actually more common than prior decades due to flight and internet. They aren't for me though. I want to at least live within 25 minutes of someone I am seeing even if we spend a lot of time doing our own things. But I also have the luxury of living in one of the biggest cities in the US where there are millions of young singles and in particular one whom I adore.
Isabela_Grace,No. The longer it goes the higher the odds of failure. Closing the gap is either a priority or it’ll eventually fail and be a massive waste of time. If you don’t have the means to close the gap in a few months max I’d just avoid it. Unless you live in the woods there’s likely someone nearby.
Fine-Relationship326,No there not real. You gotta be with the person physically in order for anything to work ….
[deleted],"Nope, don’t see the point in it. What’s the point in having a partner who you don’t see, don’t have sex with, don’t go on dates with, and very rarely spend time with? To me, that’s not a relationship, it’s a pen pal. That’s just my opinion, I’m not disregarding the fact that LDR’s can/have worked, but that’s just my view."
LifeRound2,I did that for a while recently. Did not enjoy.
Status_Bee_7644,Nope
sojulovr,not mine but my cousin’s: their bf & them have been dating since hs and i think they’ve been together for 5 years? or more idk. he lived 2 hours from us and they went from seeing eo a few times a month to moving in together not long ago. think they’ve been living together a little over two years now. another friend they’ve been ldr for as long as i remember. she lived in norcal & i think her bf lived in texas? they’re engaged now
thrax7545,"Long distance is and always has been an extremely tough sell. It only makes sense under extenuating circumstances, with capital C caveats."
Sorenduscai,No. No point.
Oozex,"I've had two long distance relationships start after being together for 2-3 years. Both failed miserably. First girlfriend was telling people she was single and I only found out because a friend brought it up. Second girlfriend I did long distance with wasn't ready to move cities with me, but wanted to stay together. 3-4 months after I'd moved, she told me she had become a stripper after being a childcare worker for years. It bothered me, but I was happy for her to do what she wanted until her nights working started becoming secretive and her descriptions vague. Good stuff. I don't reccomend any sort of long distance."
No-Tip-4807,i believe it works for some but its not for everyone
carortrain,"It worked for me and my ex girlfriend, but I think there are a few reasons why. For one, we knew each other for a good bit of time beforehand, had already been dating, and had a good relationship/chemistry. We wanted to date and did not want to break up, but the reason we had to do long distance was unrelated to our relationship. It was not just a convenient option for us, it was something we both wanted to do, and something we wanted to continue later in the future (as in dating each other). I don't see how it works with people you barely know, or people you've never met in real life yet. It just seems like too much of a gamble, if you'll be compatible or not when you meet up. It's also near impossible to form a real connection or develop any sense of trust. Trust is probably the biggest thing you need. If you don't trust the person, you will go crazy worrying about what they could be doing. It can be hard, but you have to take the risk. You can't control what someone does when they are away, and frankly, it's hard to verify what they say they did being true or not. We kept in touch daily, mainly using audio messages, sometimes text, a phone call in the evenings. We would also ""hookup"" over video calls and send letter to each other. Staying in touch is a big part of making it work. I don't think it would feel as good if you didn't hear from your partner for 4 days and they are 5000 miles away. Regular communication is key. And really it will always be hit or miss if it works. A lot can change in a day, let alone a few months or years apart. When you get back together, it can feel like the first time again, fresh and new, or it can feel different in a way you didn't expect. There are lots of stories of LDR that end when they finally get back together. Both people have just changed and grown apart without being able to do so together. I think it will work if you and the other person really want it to work. If there is even a bit of hesitation from one or both sides, it's likely going to fizzle out over time. Nothing will ever compare to being together in person and being able to talk face to face. Even though I loved my girlfriend dearly when we did the LDR, I would grow bored and it felt stale at times. Just sending messages and calls gets really old, even when you do love the person. We both also had times where we felt insecure about what the other person was doing or who they were with. At the end of the day it worked out for us, but it required a good bit of work from both of us. As someone's who's done it before. I would say it's probably the last situation I'd want to be in again with a partner. You REALLY have to love them and want them to make it work. And in all honestly with the majority of people you date, the connection is not going to be strong enough for it to be enjoyable or for it to work out. LDR is not meant to be a fix, nor is it something I believe we should seek out on purpose. It's a band-aid to maintain the relationship through a rough patch. If you find yourself in that situation, you can use it as a way to continue the relationship even when apart for some time. But I would not recommend doing it on purpose, or actively trying to date someone where it has a very real possibility of happening in the short term. Also I want to add one thing I saw in another comment that I originally didn't think of. I will only work out well, if the long distance part has a concrete end time, not just ""oh, I should be back in a few years"". In my case with my ex, we had an exact return date, so we knew exactly when we would be together again. Honestly it would be a hopeless and depressing feeling having no idea when you will be together again. So at least make sure you have a good timeline before you decide to do it."
Honest-Victory2996,"Not really, my last ex was the love of my life and I saw myself with her long term, then I got into school 7 hours away for grad school (a life changing opportunity) originally she was going to move with me but backed out last minute.. I admit the feasibility of it wasn’t the best, she has a whole zoo in her house. I found out I start really craving attention/touch and it’s almost unbearable after 2 months. Broke up, tried again, then pushed on for 4 months.. by this point, she bought a house and my job is kind of a rare position so you kinda move where the jobs are… with no end in sight and the pain I was feeling being alone, I broke up with her again, broke her heart and I do hate myself for it. She really was incredible just wrong time completely. The universe has a sick sense of humour"
thewhiterosequeen,Being pen pals who maybe occasionally meet to hook up isn't a sustainable relationship.
Suitable-Ranger-6064,Never did
Training-Web-3491,Nope
CrosPaws,"Sadly, I have not had great luck… my high school girlfriend cheated on me numerous times when I moved an hour and a half away to go to college. She didn’t tell me until after we broke up (years later). I just feel that there is some sort of an emotional disconnect when there is too much distance between you and your partner."
[deleted],Hell no.
[deleted],Yeh
guessillbehere,I do when both parties put in the work.
Agreeable_Warning_85,"You just connect with me once, I will make you gaze stars for therapy"
Gypsy_Wheel,"I don’t believe in that. Cause I have a lot of examples, when couples break up after separation to different cities or countries. One of my acquaintances got divorced last month, cause he lived in Thailand, his wife was going on business trips all the time. The most recent story is about pilot who changed his job and he had to move to another country. His wife and his son stayed home. So, now he starts interacting with other people, including women. He maintains new friendships, attends different activities. His wife goes on vacation with his son by herself. So, unfortunately, I think that the next step could be divorce…"
disputeaz,Been dating like this for 2 years. Ended as suddenly as started. Not worth the time
[deleted],Yes but I think it takes a certain kind of person (or I should say people) for it to work.
No_Neighborhood_6747,I’ve done it before and they’ve never bothered to come see me or anything. So I have no interest in doing it again.
chilldudeohyeah,No. It's hard for everyone and very tiresome.
[deleted],Not really sorry…
ewaewawa,"I think they can work, but I'd say it's better to avoid it. People don't show themselves completely on the internet so you won't get to truly know the person. And maybe it's just my preference but i dont think i could truly build a strong emotional connection to a person I've only talked to online with. I could do long distance if i start dating the person irl n then if for some circumstances we'd need to be apart."
Elegant-Peach133,No. I never did and still don’t.
Mugisha-Caleb-648,"Yeah for sure Normally it's not about Long distance but the person you meet . It can hurt or heal depends on the partner. I have been in a long distance relationship and it was more sweeter than any love i have been through , but love always hurts in the end"
crowsteeth,I don't believe in anything anymore.
LostB3ar,Man reading threads like these make me anxious cause I am in a LDR. Everyone is just so negative on reddit 🥲
MTB_life2004,"Yes, my brother has been in one for 4 years, she lives in Mexico, he lives in Belgium, she comes to us every year, and he goes there every year, for 3-5weeks. And since recently they are engaged, she will move here as soon as possible. It's possible, but not for everyone it seems like. It needs dedication and trust."
ThErmac367,It never does. Just trust me
[deleted],Nope. Don't believe in close distance either. I just vibe alone
[deleted],Yes
[deleted],Nah that’s not a real relationship
Sea-Software2101,"i tried to, but after 2 failed attempts not really. i think they can work if both partners are willing & like every other reply: if there’s an end date."
Peachcream69,Hell nahh
GoddessIs,Yes! Absolutely!
Master-Try5369,not rly
[deleted],Hell no
1pitythef00,"It’s much easier (but still crappy) if you know when you’ll stop being long distance. In my experience, longer-term LDRs without a specific plan to be together in person aren’t great."
pinkjesrocks,I completely agree
GamingCatLady,"I married mine! Haha met him when we were 14 in a Pike.on chatroom, started dating at 17, married at 29 :) 12 years and counting. Loyalty and trust and visits during school breaks :)"
Burntoastedbutter,"My ex and first relationship was a LDR. Not great and would not recommend a LDR as a first relationship unless you've been dating irl first. I was young and naive, lacked relationship exp, and he was 7 years older. I outgrew him mentally within a couple years and realised the only reason we got along was because he was stuck in the past and emotionally immature. Also never fall for the sunk cost fallacy! My current relationship was also a LDR (after I said I'd never do one again lol) and it is a 180° from my ex. Made sure I never made the same wrong decisions and mistakes again. Biggest one being meeting in person first before being official. Irl chemistry is different from online chemistry. Sometimes it can be better, and sometimes it can really be worse! This goes for every relationship, but get all those deal breakers out of the way and make sure you both have similar life end goals BEFORE deciding to start one. Ofc some things can always change after years, but that's life..."
moretodorito,"Im in one atm. Its hard. When you go through the ups and downs and life, and your partner isn't there in person, it can hit really hard. But i personally believe those in long-distance relationships experience a deeper kind of love, which is amazing. Because if distance cant get in the way, nothing will! And oh, the feeling when we'll finally be able to live together...I think thats just unbeatable!"
celestialism,"Just moved in with my wife after 7 and a half years of long-distance. We were exceptionally good at it because we're great communicators with decent tech skills for navigating FaceTime snafus, etc. and we have also had a lot of phone sex over the years."
So_Call_Me_Maddie,"Spent a year disconnected from my boyfriend (now husband). What made it work for us was setting a routine. We said good morning each day, messaged each other throughout the day, and always talked about our day at the end before saying good night. We planned Skype (yes, I'm that old!) date nights every Friday. We'd either order or make the same meal and watch the same movie. It was all about still being connected to each other's days."
bitter_sweet9798,"I did 8 years of long distance (across countries and continents) We gave it everything we had to keep our relationship alive. Communication and trust were our foundation, but having a plan for the future was essential. Today, we’re married, and I fall more in love with this man and our relationship every day. It was tough, exhausting, and at times painful but it’s worth it when both people are truly committed."
